#,Question,Option A,Option B,Option C,Option D,Option E,Correct Answer,Explanation,Domain,Competency
260,How can tracking resource requests vs. actual usage for Pods help optimize Kubernetes cluster costs?,"It allows increasing requests to guarantee performance, regardless of cost.","It helps identify ""stranded capacity"" where allocated resources (requests) are consistently higher than usage, indicating potential savings.",It determines the best CNI plugin to use for reducing network latency.,It automatically selects the cheapest cloud provider region for deployment.,It increases the number of nodes to improve availability.,B,"Resource requests guarantee capacity but also dictate scheduling and potentially cost (especially with Cluster Autoscaler). If actual usage is consistently far below requests, the allocated resources are wasted (""stranded capacity""). Right-sizing requests closer to usage allows better bin-packing and potential node reduction.",Cloud Native Observability,Cost Management
261,"Which observability pillar would be most useful for answering the question: ""What was the exact error message generated by service X at 3:15 PM yesterday?""",Metrics,Traces,Logs,Dashboards,Service Level Objectives (SLOs),C,"Logs record discrete, timestamped events, often including detailed contextual information like error messages, stack traces, and specific variable values at the time of the event. This makes them ideal for post-mortem debugging of specific incidents.",Cloud Native Observability,Telemetry & Observability
262,"Prometheus uses Service Discovery mechanisms (e.g., Kubernetes SD) primarily for what purpose?",To automatically discover TLS certificates for secure scraping.,To find and dynamically update the list of target endpoints it needs to scrape.,To discover available Grafana dashboards for visualization.,To determine which users are authorized to query metrics data.,To identify which version of Prometheus server is running.,B,"In dynamic environments like Kubernetes, Pod IPs change frequently. Service Discovery integrations allow Prometheus to automatically query the Kubernetes API (or other sources) to find the current set of targets (e.g., Pods matching specific labels) and their scrape endpoints, eliminating manual configuration.",Cloud Native Observability,Prometheus
263,"What is the concept of ""showback"" or ""chargeback"" in cloud cost management, often enabled by observability data?",Showing users the real-time stock price of the cloud provider.,Charging users based on the number of dashboards they create.,Allocating infrastructure costs back to the specific teams or applications that consumed the resources.,Showing developers feedback on their code quality based on metrics.,Charging a flat fee per namespace regardless of usage.,C,"Showback (reporting usage/cost) and Chargeback (actually billing internally) involve attributing shared infrastructure costs to the consuming business units, teams, or applications. This requires observability data (resource usage metrics, labels/tags) to correlate consumption with specific owners.",Cloud Native Observability,Cost Management
264,OpenTelemetry aims to standardize which parts of the observability pipeline?,Only the visualization layer (dashboards).,Only the long-term storage of metrics data.,"The generation, collection, and export of telemetry data (APIs, SDKs, protocols).",Only the alerting and notification mechanisms.,The configuration format for Prometheus scrape jobs.,C,"OpenTelemetry provides vendor-neutral APIs, SDKs for instrumenting code, a collector for processing/exporting data, and protocols (like OTLP) to standardize how telemetry data is produced and transmitted, aiming to avoid vendor lock-in at the instrumentation level.",Cloud Native Observability,Telemetry & Observability
265,"What type of Prometheus metric is most suitable for tracking a value that can arbitrarily increase or decrease, like the current number of active connections?",Counter,Gauge,Histogram,Summary,Info,B,"A Gauge represents a single numerical value that can go up or down. It's suitable for metrics like temperature, current memory usage, or the number of items in a queue. Counters only go up (or reset to zero). Histograms and Summaries track distributions.",Cloud Native Observability,Prometheus
266,"Why is tagging or labeling resources (e.g., Pods, Nodes, cloud resources) crucial for effective cost management in a shared cloud-native environment?",It improves the performance of the Kubernetes scheduler.,"It allows cost allocation and analysis based on specific teams, projects, or environments.",It automatically encrypts data associated with the tagged resources.,It enables the use of Vertical Pod Autoscaler (VPA).,It increases the fault tolerance of the control plane.,B,"In shared environments, costs are aggregated. Consistent tagging/labeling allows organizations to filter cost and usage data (often provided by cloud providers or third-party tools) to understand how much each project, team, environment, or application is contributing to the overall cloud spend.",Cloud Native Observability,Cost Management
267,Grafana is often used alongside Prometheus. What is Grafana's primary role in this context?,To store long-term metrics data collected by Prometheus.,To generate alerts based on Prometheus metrics.,To provide data visualization and dashboarding for Prometheus metrics (and other sources).,To replace the Prometheus server for scraping targets.,To manage Prometheus configuration files.,C,"Grafana is a popular open-source visualization platform. It excels at querying data sources like Prometheus and displaying the time-series data in flexible, interactive dashboards with various graph types, tables, and alerts (though Alertmanager is Prometheus's native alerter).",Cloud Native Observability,Telemetry & Observability
268,What does the rate() function in PromQL typically calculate?,The total count of a metric over a time range.,The average value of a gauge metric over a time range.,The per-second average rate of increase for a counter metric over a time range.,The 95th percentile value of a histogram metric.,The current value of a metric label.,C,"Counters continuously increase. rate() calculates how fast a counter is increasing per second, averaged over a specified time window. This is essential for understanding throughput or frequency of events (e.g., HTTP requests per second, errors per second).",Cloud Native Observability,Prometheus
269,Which strategy helps manage costs associated with persistent storage in Kubernetes?,Using only hostPath volumes for all stateful applications.,Regularly reviewing PersistentVolumeClaim (PVC) usage and cleaning up unused volumes.,Disabling the Container Storage Interface (CSI) plugin.,Storing all application data within container images.,Setting storageClassName to a non-existent class.,B,"Persistent storage often incurs costs. Orphaned PVCs (no longer used by any Pod) or PVCs attached to terminated resources can lead to unnecessary spending. Regularly auditing PVCs and deleting unused ones, potentially based on age or lack of mounting, is a key cost optimization practice.",Cloud Native Observability,Cost Management
270,"What is a ""Service Level Objective"" (SLO) in the context of observability and SRE?",A detailed log message indicating a service failure.,A contractual agreement with a cloud provider for uptime (SLA).,"A specific, measurable target for a service's reliability or performance (e.g., 99.9% availability).",A dashboard showing real-time resource utilization.,An alert configured in Alertmanager.,C,"An SLO is an internal target for service reliability, often based on user happiness metrics (e.g., availability, latency). Observability data (metrics, logs) is used to measure performance against SLOs. Service Level Indicators (SLIs) are the metrics used to measure SLO compliance. SLAs are external agreements.",Cloud Native Observability,Telemetry & Observability
271,What information does a Prometheus Histogram metric provide that a simple Gauge or Counter does not?,The exact time when the metric last changed value.,The total number of times an event has occurred.,The distribution of observed values across a set of configurable buckets.,The current status (up/down) of the monitored target.,The geographic location of the monitored instance.,C,"Histograms sample observations (e.g., request latencies) and count them in configurable buckets (e.g., <=100ms, <=200ms, <=500ms). They also provide the sum and count of observations. This allows calculating approximate quantiles (e.g., 95th percentile latency) using functions like histogram_quantile().",Cloud Native Observability,Prometheus
272,"How might analyzing network egress data, often available via cloud provider monitoring or specialized tools, help control costs?",By optimizing DNS resolution times within the cluster.,"By identifying unexpected or excessive data transfer out of the cluster/cloud, which often incurs costs.",By improving the efficiency of the CNI plugin's IP address allocation.,By reducing the number of LoadBalancer services used.,By increasing the MTU size for Pod network interfaces.,B,"Cloud providers typically charge for data transferred out to the internet or sometimes between regions/availability zones. Monitoring egress traffic helps identify applications sending large amounts of data unexpectedly, allowing investigation and potential optimization to reduce data transfer costs.",Cloud Native Observability,Cost Management
273,Jaeger and Zipkin are open-source tools commonly used in cloud-native environments. Which observability pillar are they primarily associated with?,Metrics aggregation and storage.,Log collection and analysis.,Distributed Tracing backend and visualization.,Alerting and notification routing.,Service discovery configuration management.,C,"Jaeger and Zipkin are popular open-source distributed tracing systems. They receive trace data (spans) generated by instrumented applications (often using OpenTelemetry or native libraries), store it, and provide UIs for visualizing request traces and analyzing service dependencies and latency.",Cloud Native Observability,Telemetry & Observability
274,What is the purpose of the job label automatically added by Prometheus during scraping?,To identify the specific metric name being scraped.,To indicate the IP address and port of the scraped target.,"To group targets belonging to the same scrape configuration (e.g., ""kubernetes-pods"").",To specify the data center location of the Prometheus server.,To store the timestamp of the last successful scrape.,C,"Prometheus configuration defines scrape jobs (e.g., a job to scrape all pods with label app=api). The job label is automatically attached to all metrics scraped from targets within that job definition, allowing easy filtering and aggregation for all instances of a particular service type.",Cloud Native Observability,Prometheus
275,"Which Kubernetes object can set default resource requests and limits for containers within a namespace if not specified in the Pod spec, indirectly aiding cost predictability?",ConfigMap,Secret,LimitRange,HorizontalPodAutoscaler,MutatingWebhookConfiguration,C,"A LimitRange can enforce minimum/maximum resource constraints and, crucially, apply default requests and limits to containers that don't explicitly define them. This ensures Pods have some resource boundaries set, preventing unbounded consumption and aiding resource allocation and cost estimation.",Cloud Native Observability,Cost Management
276,"What is meant by ""cardinality"" in the context of Prometheus metrics and labels?",The number of different metric names exposed by a target.,The total number of targets being scraped by Prometheus.,The number of unique time series generated by a metric name and its distinct label combinations.,The frequency at which Prometheus scrapes a specific target.,The storage duration configured for metrics data.,C,"High cardinality occurs when a metric has many unique combinations of label values (e.g., using user ID or request ID as a label). This creates many distinct time series, which can significantly increase resource consumption (memory, CPU, storage) on the Prometheus server. Managing cardinality is crucial.",Cloud Native Observability,Telemetry & Observability
277,What is the difference between the up metric automatically generated by Prometheus and application-specific health check metrics?,"up is a gauge, while health checks are counters.",up indicates scrape success; health checks indicate application functionality.,up is only generated for Kubernetes Pods; health checks are for external services.,up requires custom instrumentation; health checks are built-in.,up triggers Alertmanager directly; health checks require PromQL rules.,B,"Prometheus automatically generates an up{job=""..."", instance=""...""} metric for each target scrape (1 if successful, 0 if failed). This only tells if Prometheus could reach the /metrics endpoint. Application health checks (e.g., a /healthz endpoint) verify internal application logic or dependencies.",Cloud Native Observability,Prometheus
278,Tools like Kubecost or OpenCost integrate with Kubernetes and cloud providers primarily to achieve what?,To automatically optimize application code for better performance.,"To provide detailed cost allocation, monitoring, and optimization insights specific to Kubernetes workloads.",To replace the need for Prometheus and Grafana entirely.,To manage user authentication and RBAC policies within the cluster.,To deploy and manage CNI network plugins.,B,"These tools specialize in Kubernetes cost management. They correlate resource usage data (from metrics) with cloud billing data and Kubernetes object metadata (labels, namespaces) to provide granular insights into how much specific deployments, teams, or namespaces are costing and where optimizations are possible.",Cloud Native Observability,Cost Management
279,What is a potential downside of relying only on logs for observability?,Logs cannot capture detailed error messages.,Logs are difficult to aggregate and query for trends or patterns across many instances.,Logs do not provide timestamps for events.,Logs cannot be generated by most modern applications.,Logs cannot be stored centrally.,B,"While detailed, querying massive volumes of logs from distributed systems to understand overall trends (e.g., average latency, error rate) or relationships between events across services can be slow, expensive, and complex compared to querying pre-aggregated metrics or structured traces.",Cloud Native Observability,Telemetry & Observability
280,How does Prometheus's remote_write feature contribute to observability?,It allows Prometheus to scrape targets located in remote data centers.,It enables Prometheus to send alerts directly to remote notification systems.,It allows Prometheus to forward ingested metrics to long-term storage or other analysis systems.,It lets users remotely query Prometheus metrics via an API.,It configures remote Grafana instances automatically.,C,"remote_write allows Prometheus to stream its collected metrics data in near real-time to compatible remote endpoints. This is commonly used for long-term storage solutions (e.g., Thanos, Cortex, VictoriaMetrics, cloud vendor TSDBs) that can handle larger data volumes and longer retention periods.",Cloud Native Observability,Prometheus
281,Allocating costs based on Namespace in Kubernetes is a common strategy. What is a prerequisite for this approach to be effective?,All Pods must run with hostNetwork: true.,"Resources (Pods, PVCs, Services) must be consistently deployed into appropriate team/application-specific Namespaces.",The cluster must use the Cluster Autoscaler.,All applications must be instrumented with OpenTelemetry.,Only LoadBalancer services should be used for external access.,B,"If resources belonging to different teams or applications are mixed within the same Namespace, attributing costs accurately becomes difficult. A disciplined approach where each team or application has its own Namespace(s) allows usage and costs to be aggregated at the Namespace level.",Cloud Native Observability,Cost Management
282,"What is the primary goal of correlating different observability signals (e.g., linking a trace ID in logs to a specific distributed trace)?",To reduce the storage cost of telemetry data.,To allow visualization of metrics in Grafana.,To provide a more complete context for troubleshooting by connecting related events across signals.,To replace the need for manual code instrumentation.,To standardize the format of log messages.,C,"Finding a specific trace ID in application logs allows you to quickly jump to the corresponding distributed trace in Jaeger/Zipkin, showing the entire request flow. Linking metrics spikes to specific error logs provides context. Correlation ties the pillars together for faster, more effective debugging.",Cloud Native Observability,Telemetry & Observability
283,What does the Prometheus Query Language (PromQL) primarily operate on?,Raw log files stored on disk.,Relational database tables containing event data.,Time series data identified by metric names and key-value labels.,Distributed trace spans stored in Jaeger or Zipkin.,Kubernetes API object definitions (YAML).,C,PromQL is specifically designed to query and manipulate the time series data stored in Prometheus's TSDB. Its functions and operators work on vectors (sets) of time series selected using metric names and label matchers.,Cloud Native Observability,Prometheus
284,"When evaluating cloud costs, what is a key difference between ""reserved instances"" (RIs) or ""savings plans"" and ""on-demand"" pricing?",On-demand instances offer better performance than RIs.,"RIs provide significant discounts in exchange for a commitment to usage (e.g., 1 or 3 years).",On-demand pricing is only available for serverless functions.,RIs can only be used for Kubernetes control plane nodes.,On-demand instances have guaranteed availability; RIs do not.,B,Cloud providers offer lower hourly rates for compute resources via RIs or Savings Plans if customers commit to a certain level of usage for a defined term. On-demand pricing offers flexibility but at a higher hourly cost. Usage data from observability helps determine appropriate RI/SP commitments.,Cloud Native Observability,Cost Management
285,Which statement accurately describes structured logging?,Writing logs only in binary format for performance.,Writing log entries as plain text strings with embedded timestamps.,"Writing logs in a consistent, machine-readable format (e.g., JSON) with key-value pairs.",Only logging metrics data instead of event descriptions.,Encrypting all log messages before writing them to disk.,C,"Structured logging involves formatting log output as data structures (like JSON) rather than free-form text. This makes logs much easier to parse, filter, and analyze programmatically by log aggregation tools (like Elasticsearch, Loki), improving querying capabilities.",Cloud Native Observability,Telemetry & Observability
286,What problem does the Prometheus scrape_timeout configuration setting address?,It limits how long Prometheus waits for Alertmanager to respond.,It defines the maximum duration Prometheus will wait for a target to respond during a scrape.,It sets the retention period for metrics data in the TSDB.,It controls how often Prometheus reloads its configuration file.,It limits the number of concurrent scrapes Prometheus can perform.,B,"If a target is slow to respond or hangs, Prometheus needs a timeout to avoid waiting indefinitely and blocking other scrapes. scrape_timeout defines this limit; if the target doesn't respond within this duration, the scrape fails, and the up metric becomes 0.",Cloud Native Observability,Prometheus
287,"How can FinOps principles, which emphasize cloud financial accountability, be applied within a Kubernetes environment?",By giving developers unrestricted access to create cloud resources.,By focusing solely on reducing performance to minimize costs.,By integrating cost visibility (via observability) into engineering workflows and decision-making.,By manually approving every deployment to the cluster.,By using only open source software to avoid licensing fees.,C,"FinOps brings financial accountability to the cloud. In Kubernetes, this means using observability tools (metrics, tags) and cost monitoring platforms to make costs visible to engineers, enabling them to understand the cost implications of their architectural choices and resource requests, fostering optimization.",Cloud Native Observability,Cost Management
288,What is a key challenge when collecting traces in high-throughput systems?,Traces do not support capturing latency information.,Generating and storing trace data for every request can be resource-intensive and costly.,Traces cannot be correlated with logs or metrics.,Trace data cannot be visualized effectively.,Only specific programming languages support trace instrumentation.,B,Capturing detailed trace data for every single request in a high-volume system can generate massive amounts of data and add performance overhead. Sampling (collecting traces for a subset of requests) is often employed to manage this overhead while still providing representative insights.,Cloud Native Observability,Telemetry & Observability
289,"If you see rapidly increasing cardinality for a specific Prometheus metric, what is a likely cause related to labels?",The scrape interval for the metric's job is too short.,The metric name itself is changing frequently.,"A label value associated with the metric is highly dynamic and unique per instance/request (e.g., user ID, Pod ID, timestamp).",The Alertmanager configuration is incorrect.,The remote_write endpoint is unavailable.,C,"High cardinality is almost always caused by labels having too many unique values. Using identifiers like user IDs, session IDs, request IDs, or exact timestamps as label values creates a new time series for each unique value, leading to cardinality explosion.",Cloud Native Observability,Prometheus
290,Why is monitoring resource limits alongside usage and requests important for cost and stability?,Limits directly determine the cost charged by the cloud provider.,High limit values guarantee better application performance.,"Frequent throttling due to hitting CPU limits, or OOMKills due to hitting memory limits, indicate potential misconfiguration affecting stability and performance.",Limits prevent the Cluster Autoscaler from adding new nodes.,Limits are only relevant for stateful applications.,C,"Limits enforce resource caps. If a Pod frequently hits its memory limit, it gets OOMKilled (unstable). If it frequently hits its CPU limit, it gets throttled (poor performance). Monitoring these events indicates that limits might be too low, or the application needs optimization, impacting both stability and user experience.",Cloud Native Observability,Cost Management
291,What is the role of time-series data (metrics) in proactive observability?,Primarily useful only for debugging specific past incidents.,"Used to establish baselines, detect anomalies, and predict future trends or potential issues.",Only valuable when combined with distributed tracing data.,Cannot be used effectively for real-time alerting.,Replaced entirely by structured logging in modern systems.,B,"Analyzing trends, seasonality, and deviations from normal patterns in metrics data allows teams to detect potential problems (e.g., resource exhaustion, performance degradation) before they cause significant user impact. This enables proactive alerting and capacity planning.",Cloud Native Observability,Telemetry & Observability
292,"When configuring Prometheus alerting rules, what is the purpose of the for clause?","To specify the receiver for the alert (e.g., Slack channel).",To define the duration an alert condition must be true before the alert becomes firing.,"To set the severity label for the alert (e.g., critical, warning).",To group multiple related alert conditions into a single rule.,To add annotations with contextual information to the alert.,B,"Network glitches or brief spikes can cause alert conditions to flap. The for clause requires a condition to be continuously true for a specified duration (e.g., 5 minutes) before the alert transitions from pending to firing state and gets sent to Alertmanager, reducing noise from transient issues.",Cloud Native Observability,Prometheus
293,"What does ""right-sizing"" mean in the context of Kubernetes resource requests/limits and cost management?",Always setting requests and limits to the maximum allowed values.,Setting requests and limits based on observed application usage patterns to avoid waste.,Using only the largest available node types in the cluster.,Disabling resource limits entirely for better performance.,Matching resource requests exactly to the node's capacity.,B,"Right-sizing involves analyzing actual resource consumption (using metrics from observability tools) and adjusting the resources.requests and resources.limits in Pod specs to align closely with actual needs, minimizing over-provisioning (waste) while ensuring sufficient resources for performance.",Cloud Native Observability,Cost Management
294,Which observability pillar is typically the most voluminous and potentially most expensive to store and process?,Metrics,Traces,Logs,Events,SLOs,C,"Applications often generate vast amounts of log data, especially at debug levels or in verbose systems. While metrics and traces can also be large, raw log volumes frequently surpass them, leading to significant storage and processing costs in centralized logging systems.",Cloud Native Observability,Telemetry & Observability
