#,Question,Option A,Option B,Option C,Option D,Option E,Correct Answer,Explanation,Domain,Competency
192,"In a Service Mesh, what is the typical role of the ""data plane""?",To define global policies and configurations for service communication.,To collect telemetry data and send it to a centralized monitoring system.,"To actually handle and proxy network traffic between services (e.g., using sidecars).",To provide a user interface for managing and visualizing the mesh.,"To manage the lifecycle of service instances (deploy, scale, heal).",C,"The data plane consists of the network proxies (usually sidecars like Envoy) that are deployed alongside each service instance. These proxies intercept, inspect, and route all network traffic to and from the services, enforcing policies received from the control plane.",Cloud Native Infrastructure,Service Mesh
193,"What does the accessModes field (e.g., ReadWriteOnce, ReadOnlyMany, ReadWriteMany) on a PersistentVolume signify?","The speed of the underlying storage (e.g., SSD vs. HDD).",The encryption status of the volume.,How the volume can be mounted by nodes and Pods.,The backup policy for the volume.,The geographical region where the storage is located.,C,accessModes define how many nodes can mount the PV and in what mode. ReadWriteOnce (RWO) means it can be mounted read-write by a single node. ReadOnlyMany (ROX) means read-only by many nodes. ReadWriteMany (RWX) means read-write by many nodes. ReadWriteOncePod (RWOP) is read-write by a single Pod.,Cloud Native Infrastructure,Storage
194,What differentiates a PodSecurityPolicy (deprecated) or its successor (Pod Security Admission) from a NetworkPolicy?,PodSecurityPolicy controls network access; NetworkPolicy controls Pod privileges.,"PodSecurityPolicy defines what a Pod can do (e.g., host access, privileges); NetworkPolicy defines network connectivity.",Both control the same aspects but at different scopes (namespace vs. cluster).,NetworkPolicy is implemented by CNI; PodSecurityPolicy by the runtime.,PodSecurityPolicy is for ingress; NetworkPolicy is for egress.,B,"Pod Security Admission (and its predecessor PSP) define a set of conditions a Pod must run with to be accepted into the cluster (e.g., running as non-root, not using host networking, allowed volumes). NetworkPolicy controls L3/L4 network traffic flow to/from Pods.",Cloud Native Infrastructure,Security
195,How does Kubernetes DNS enable service discovery for a Service named my-svc in namespace my-ns from another Pod in the same namespace?,The Pod queries for my-svc.my-ns.svc.cluster.local.,The Pod queries for my-svc.,The Pod queries for the ClusterIP of my-svc directly.,kube-proxy injects the IP of my-svc into the Pod's /etc/hosts.,Pods cannot discover services in the same namespace via DNS.,B,"Within the same namespace, a short Service name (e.g., my-svc) is sufficient for DNS resolution because the namespace is part of the Pod's DNS search path. For cross-namespace, my-svc.my-ns or the FQDN my-svc.my-ns.svc.cluster.local would be used.",Cloud Native Infrastructure,Networking
196,"What is the primary purpose of the volumeMode field (e.g., Filesystem, Block) in a PersistentVolume and PersistentVolumeClaim?",To specify whether the volume should be encrypted.,To indicate if the volume supports snapshots.,To determine if the volume should be presented as a mounted filesystem or a raw block device.,To define the accessModes allowed for the volume.,To set the default permissions for files created on the volume.,C,"volumeMode allows a PV to be exposed as either a mounted filesystem (default) or as a raw block device. Block mode is useful for applications that need direct access to a block device, like certain databases.",Cloud Native Infrastructure,Storage
197,"If a container image specifies a USER instruction, but the Pod's SecurityContext also defines runAsUser, which value typically takes precedence?",The USER instruction in the Dockerfile.,The runAsUser from the Pod's SecurityContext.,Neither; the container will run as root by default.,"The values are merged, leading to an error.",The kubelet decides based on node configuration.,B,Kubernetes' SecurityContext settings (at Pod or container level) generally override the USER instruction baked into the container image. This allows cluster administrators to enforce security policies regardless of how an image was built.,Cloud Native Infrastructure,Security
198,One of the challenges in early container adoption was managing many containers across many hosts. What core capability did orchestrators bring to solve this directly?,Standardization of container image formats.,Automated cluster-wide scheduling and resource management.,Tools for building smaller container images.,Secure private container image registries.,Faster container boot times.,B,"While all options are part of the broader ecosystem, the direct answer to managing many containers on many hosts is the automated scheduling (placing containers on appropriate hosts) and resource management (allocating CPU/memory) provided by orchestrators like Kubernetes.",Cloud Native Infrastructure,Container Orchestration Fundamentals
199,Which Kubernetes autoscaling mechanism adjusts the CPU and memory requests and limits of existing Pods based on historical usage data?,Horizontal Pod Autoscaler (HPA),Cluster Autoscaler (CA),Vertical Pod Autoscaler (VPA),Node Problem Detector (NPD),Custom Pod Autoscaler (CPA),C,"VPA analyzes resource usage and modifies the resources.requests and resources.limits for containers within Pods, aiming for optimal resource allocation. HPA changes replica counts, and CA changes the number of nodes.",Kubernetes Architecture,Autoscaling
200,"What is the fundamental characteristic of a ""Serverless"" computing model from the developer's perspective?",The complete absence of servers in the underlying infrastructure.,The ability to run code without managing or provisioning underlying servers or infrastructure.,The use of specialized hardware accelerators for function execution.,A pricing model based solely on CPU cycles consumed.,The requirement to write code only in specific languages like Node.js or Python.,B,"Serverless abstracts away the underlying infrastructure (servers, OS, patching). Developers provide code/functions, and the platform handles provisioning, scaling, and management needed to run that code, often triggered by events.",Kubernetes Architecture,Serverless
201,What is the primary role of the Cloud Native Computing Foundation (CNCF)?,To develop and sell commercial distributions of Kubernetes.,To define and enforce specific implementation details for cloud provider services.,"To host and nurture open source projects, fostering collaboration in the cloud native ecosystem.",To directly manage the development lifecycle of the Linux kernel.,To certify individual developers as cloud native experts through exams only.,C,"CNCF provides a neutral home for critical open source projects (like Kubernetes, Prometheus, Envoy), offering governance, marketing, and community support to promote the adoption of cloud native technologies.",Kubernetes Architecture,Community and Governance
202,"In a typical cloud native environment, which persona is primarily focused on building and maintaining the underlying platform (e.g., Kubernetes cluster) itself?",Application Developer,End User,Platform Engineer / Operator / SRE,Data Scientist,Business Analyst,C,"Platform Engineers, Operators, or Site Reliability Engineers (SREs) are responsible for the infrastructure and tooling that Application Developers use. They focus on reliability, scalability, security, and maintainability of the platform.",Kubernetes Architecture,Roles and Personas
203,"Why are open standards like the OCI specifications (Image Format, Runtime) crucial for the health of the container ecosystem?",They guarantee containers will run faster than virtual machines.,They enforce the use of a single vendor's container tools for consistency.,"They promote interoperability and portability, preventing vendor lock-in and fostering innovation.",They eliminate the need for container security scanning.,They define the API specifications for Kubernetes itself.,C,"Open standards ensure that container images built with one tool can be run by different runtimes, and that different tools can work together. This gives users flexibility, prevents vendor lock-in, and allows the ecosystem to innovate collaboratively.",Kubernetes Architecture,Open Standards
204,The Horizontal Pod Autoscaler (HPA) in Kubernetes primarily makes scaling decisions based on what kind of information?,Historical resource usage patterns over weeks.,The number of nodes currently available in the cluster.,"Observed metrics like CPU utilization, memory usage, or custom metrics from Pods.",The declared priorityClassName of the Pods.,The size of the container images being used.,C,"HPA monitors metrics associated with the Pods it targets (e.g., average CPU utilization). When these metrics cross predefined thresholds, HPA adjusts the replicas count of the workload resource (e.g., Deployment, StatefulSet) accordingly.",Kubernetes Architecture,Autoscaling
205,"Which statement best describes Functions-as-a-Service (FaaS), a common implementation of serverless?","A platform for running long-lived, stateful applications with persistent connections.","An architecture where applications are decomposed into large, independently deployable services.","A model for executing stateless, event-triggered code functions without managing server infrastructure.",A service that automatically converts monolithic applications into containerized microservices.,A managed Kubernetes offering from a cloud provider.,C,"FaaS platforms (like AWS Lambda, Google Cloud Functions, Knative Serving) are optimized for running small, stateless pieces of code (functions) in response to events (e.g., HTTP requests, queue messages, file uploads), abstracting away the underlying execution environment.",Kubernetes Architecture,Serverless
206,"What does it typically mean for a project to be ""Graduated"" within the CNCF?",The project is no longer actively maintained or supported by the CNCF.,The project has just been accepted into the CNCF Sandbox stage.,"The project has demonstrated widespread adoption, stability, and strong governance.",The project is mandated for use by all CNCF member companies.,The project's source code has been formally verified for security flaws.,C,"Graduation is the highest maturity level for CNCF projects. It signifies that a project is mature, widely used in production, has healthy community dynamics, strong governance, and meets CNCF's criteria for stability and ecosystem impact.",Kubernetes Architecture,Community and Governance
207,"Which persona is most likely to interact directly with kubectl daily to deploy, troubleshoot, and manage applications running on the Kubernetes platform?",Platform Operator managing the cluster infrastructure.,Application Developer deploying and managing their specific microservices.,End User accessing the application through a web browser.,CNCF maintainer reviewing project proposals.,Security auditor reviewing RBAC policies.,B,"While Operators also use kubectl, Application Developers are typically the primary users interacting with the Kubernetes API via kubectl to manage the lifecycle of their applications (Deployments, Services, ConfigMaps, etc.) deployed onto the platform provided by Operators.",Kubernetes Architecture,Roles and Personas
208,The Container Network Interface (CNI) standard primarily addresses which aspect of container orchestration?,Container image building and distribution.,Container runtime execution and lifecycle management.,Network connectivity and IP address management for containers/Pods.,Persistent storage provisioning and attachment for containers.,Security policy enforcement within containers.,C,"CNI defines a standard interface between container runtimes (or orchestrators like Kubernetes via kubelet) and network plugins. These plugins are responsible for wiring containers into the host network and assigning IP addresses, enabling Pod-to-Pod communication.",Kubernetes Architecture,Open Standards
209,What is the primary function of the Cluster Autoscaler (CA) in Kubernetes?,To adjust the number of replicas for a Deployment based on CPU load.,To modify the resource requests/limits for Pods based on usage.,To add or remove worker nodes from the cluster based on Pod scheduling pressure.,To automatically update Kubernetes control plane components.,To balance network traffic evenly across all nodes.,C,"The Cluster Autoscaler monitors for Pods that cannot be scheduled due to insufficient resources (CPU, memory) on existing nodes. If such Pods exist, it interacts with the cloud provider (or infrastructure) to provision new nodes. It also removes underutilized nodes.",Kubernetes Architecture,Autoscaling
210,What distinguishes serverless platforms (like Knative or FaaS) from traditional Platform-as-a-Service (PaaS) regarding scaling?,PaaS cannot scale automatically; Serverless can.,Serverless platforms can typically scale down to zero instances when idle; PaaS often cannot.,PaaS scales based on node count; Serverless scales based on function memory size.,Serverless platforms only support vertical scaling; PaaS supports horizontal scaling.,PaaS requires manual intervention for all scaling operations.,B,"A key characteristic of many serverless platforms is the ability to scale down the number of running instances to zero when there are no incoming requests, reducing costs for idle applications. Traditional PaaS offerings often require at least one instance to be running continuously.",Kubernetes Architecture,Serverless
211,What is the role of a CNCF Special Interest Group (SIG) or Technical Advisory Group (TAG)?,To directly employ developers working on CNCF projects.,To provide commercial support contracts for CNCF software.,To provide technical leadership and coordinate efforts within specific domains or projects.,To vote on which projects should be accepted into the CNCF Sandbox.,To manage the financial budget of the CNCF.,C,"SIGs (often within projects like Kubernetes) and TAGs (across the CNCF landscape) are groups focused on specific technical areas (e.g., TAG Security, TAG Storage, Kubernetes SIG-Network). They provide expertise, guidance, review designs, and coordinate work within their respective domains.",Kubernetes Architecture,Community and Governance
212,An Application Developer using a cloud native platform is primarily concerned with which of the following?,Managing etcd backups and restores for the cluster.,"Writing application code, defining deployment manifests, and configuring CI/CD pipelines.",Patching the operating system on the cluster nodes.,Configuring the CNI plugin for optimal network performance.,Selecting the physical hardware for the worker nodes.,B,"The Application Developer's focus is on the application itself: writing code, packaging it (often into containers), defining how it should run in Kubernetes (e.g., Deployments, Services), and setting up automation for building and deploying it. They rely on the platform provided by Operators.",Kubernetes Architecture,Roles and Personas
213,The Container Storage Interface (CSI) standard allows Kubernetes to support various storage systems. What is the main benefit of this standardization?,It guarantees all CSI-compliant storage has the same performance characteristics.,It allows storage vendors to add support without modifying core Kubernetes code.,It eliminates the need for PersistentVolumes and PersistentVolumeClaims.,It provides a built-in data encryption layer for all storage types.,It defines the optimal way to structure data within a volume.,B,"CSI provides a standard API for storage plugins. This decouples storage provider implementations from the core Kubernetes code, allowing vendors to develop drivers independently and enabling Kubernetes users to leverage a wide variety of storage backends consistently.",Kubernetes Architecture,Open Standards
214,"When using Horizontal Pod Autoscaling (HPA) based on custom metrics, where does the HPA typically retrieve these metrics from?",Directly from the kubelet on each node.,From the Kubernetes Metrics Server (focused on resource metrics).,From monitoring systems like Prometheus via the custom metrics API (k8s-prometheus-adapter).,By parsing application log files stored in etcd.,From annotations manually added to the Deployment manifest.,C,"While HPA uses the Metrics Server for CPU/memory, custom metrics (e.g., queue length, requests per second) require an adapter (like k8s-prometheus-adapter or a cloud provider specific one) that fetches data from an external monitoring system (like Prometheus) and exposes it via the Kubernetes custom/external metrics API.",Kubernetes Architecture,Autoscaling
215,"What does ""event-driven"" architecture, often associated with serverless functions, mean?",Applications must be written using event sourcing patterns.,"Code execution is triggered by the occurrence of specific events (e.g., HTTP request, message).","The platform uses events internally for scheduling, hidden from the user.",All application state must be stored within the event payload.,Only asynchronous communication patterns can be used.,B,"In an event-driven model, components react to events. Serverless functions are often designed this way: an event occurs (like an API call, a file upload, a database change), and the platform triggers the corresponding function to process that event.",Kubernetes Architecture,Serverless
216,How does the CNCF promote cloud native principles and best practices within the community?,By mandating the use of specific programming languages for hosted projects.,By selling proprietary tools that enforce best practices.,"Through publications (e.g., blog, reports), webinars, events (like KubeCon), and fostering collaboration.",By directly managing the infrastructure for all member companies.,By providing legally binding architectural blueprints.,C,"CNCF acts as a thought leader and community hub. It shares knowledge and promotes best practices through various channels like its website, blog, webinars, research papers, landscape map, and major conferences like KubeCon + CloudNativeCon.",Kubernetes Architecture,Community and Governance
217,A Site Reliability Engineer (SRE) working with a Kubernetes platform would likely focus most on which area?,Designing the user interface for end-user applications.,"Automating platform operations, ensuring reliability/SLOs, and managing incident response.",Writing feature code for the core business applications running on the platform.,Defining the marketing strategy for the company's cloud native services.,Choosing which programming language application developers should use.,B,"SREs apply software engineering principles to infrastructure and operations problems. They focus on automating tasks, measuring and meeting Service Level Objectives (SLOs) for platform reliability, improving monitoring/alerting, and handling incidents efficiently.",Kubernetes Architecture,Roles and Personas
218,Why is the standardization provided by specifications like CRI (Container Runtime Interface) important for Platform Operators/SREs?,It allows them to use docker build commands to manage runtime configuration.,It simplifies the process of writing application code for developers.,It gives them flexibility to choose/swap runtimes without disrupting Kubernetes functionality.,It guarantees that all container runtimes will have identical performance.,It eliminates the need for managing worker nodes.,C,"CRI decouples Kubernetes (kubelet) from the specific runtime implementation. This allows platform operators to choose the runtime that best fits their needs (e.g., containerd, CRI-O) and potentially switch between them with minimal impact on the overall Kubernetes system.",Kubernetes Architecture,Open Standards
219,"If you need to automatically scale your Kubernetes cluster by adding/removing nodes based on overall resource pressure, which component is responsible?",Horizontal Pod Autoscaler (HPA),Vertical Pod Autoscaler (VPA),Cluster Autoscaler (CA),kube-scheduler,metrics-server,C,"The Cluster Autoscaler specifically monitors for unschedulable Pods (due to resource constraints) and interacts with the underlying infrastructure (e.g., cloud provider) to add more nodes. It also consolidates workloads and removes underutilized nodes.",Kubernetes Architecture,Autoscaling
220,"Which statement best describes the concept of ""scale to zero"" in serverless platforms?",The platform uses zero resources when no functions are deployed.,"Application instances are automatically removed when idle, consuming no resources.",Functions are limited to executing for zero seconds (instantaneous execution).,The platform requires zero configuration from the developer to deploy functions.,Only zero-cost open source serverless platforms support this feature.,B,"""Scale to zero"" means that if a serverless function or application receives no traffic or events for a period, the platform automatically scales down the number of running instances to zero. This stops resource consumption and associated costs during idle periods.",Kubernetes Architecture,Serverless
221,What is the significance of the CNCF Landscape (landscape.cncf.io)?,It's the official source code repository for all CNCF projects.,It's a legally binding contract defining how member companies must use CNCF software.,It provides an interactive map categorizing and organizing projects within the cloud native ecosystem.,It's the primary tool used for deploying applications to Kubernetes clusters.,It's a real-time dashboard showing the operational status of CNCF projects.,C,"The CNCF Landscape is a vital resource that attempts to map the vast cloud native ecosystem, organizing projects and products into categories (e.g., database, scheduling, observability). It helps users navigate the available tools and understand the relationships between them.",Kubernetes Architecture,Community and Governance
222,Consider the interaction between Application Developers and Platform Operators. What is a key aspect of their relationship in a healthy cloud native culture?,Operators dictate the exact programming languages developers must use.,Developers have unrestricted root access to all cluster nodes for debugging.,"Clear interfaces and responsibilities, with Operators providing a reliable platform for Developers.",Developers are solely responsible for patching the Kubernetes control plane.,Operators manually review every line of application code before deployment.,C,"A successful cloud native environment relies on a clear separation of concerns and collaboration. Operators provide a stable, automated platform with self-service capabilities, while Developers consume the platform services to build, deploy, and run their applications efficiently.",Kubernetes Architecture,Roles and Personas
223,"The existence of multiple CNI (Container Network Interface) plugins (e.g., Calico, Flannel, Cilium) demonstrates what benefit of open standards?",That CNI guarantees identical features across all network plugins.,That network configuration in Kubernetes is overly complex.,That standardization allows for choice and innovation in specific implementation areas.,That CNI plugins are only developed by the CNCF itself.,That network plugins are the least stable part of Kubernetes.,C,"The CNI standard defines how Kubernetes interacts with network plugins but not what features those plugins must provide beyond basic connectivity. This allows different vendors and projects to innovate and offer plugins with varying features (e.g., network policy enforcement, encryption, performance).",Kubernetes Architecture,Open Standards
224,You have a stateless web application deployed using a Kubernetes Deployment. Traffic fluctuates significantly. You want to automatically adjust the number of Pods based on average CPU utilization. Which tool is most appropriate?,Cluster Autoscaler (CA),Vertical Pod Autoscaler (VPA),Horizontal Pod Autoscaler (HPA) configured with a CPU utilization target.,Manually adjusting the replicas field in the Deployment manifest.,Using a DaemonSet instead of a Deployment.,C,HPA is designed specifically for this use case: scaling the number of replicas for a workload (like a Deployment) based on metrics like CPU or memory utilization.,Kubernetes Architecture,Autoscaling
225,Which is NOT a typical characteristic often associated with serverless architectures (especially FaaS)?,Stateless function execution (state managed externally).,Short-lived execution durations for functions.,Built-in requirement for managing complex state within the function instance itself.,"Event-driven triggers (e.g., HTTP, queues, storage events).",Automatic scaling based on demand (including scale-to-zero).,C,"Serverless functions are typically designed to be stateless. State should be managed externally (e.g., in databases, caches, storage services) because function instances can be created and destroyed frequently, and requests might be served by different instances with no shared memory.",Kubernetes Architecture,Serverless
