#,Question,Option A,Option B,Option C,Option D,Option E,Correct Answer,Explanation,Domain,Competency
1,"What is the fundamental reason Kubernetes uses Pods as the smallest deployable unit, rather than individual containers directly?",To simplify network configuration for containers,To enable co-location and shared resources for containers,To enforce stricter security boundaries than containers,To provide a unique IP address per container,To reduce container image size,B,"Pods allow tightly coupled containers to share resources like network namespace (IP, port space) and storage volumes, facilitating communication and data sharing for helper or sidecar patterns.",Kubernetes Fundamentals,Containers
2,Which Kubernetes control plane component is responsible for persisting the cluster's desired state and configuration?,kube-scheduler,kube-apiserver,etcd,kubelet,controller-manager,C,"etcd is a distributed key-value store that reliably stores all Kubernetes cluster data, serving as the single source of truth for the cluster's state.",Kubernetes Fundamentals,Kubernetes Architecture
3,A developer needs to expose a web application running in a set of Pods within the cluster using a stable internal IP address. Which Kubernetes resource is most appropriate?,Ingress,NodePort Service,ClusterIP Service,ExternalName Service,ReplicaSet,C,"A ClusterIP Service provides a stable internal IP address and DNS name for accessing Pods, only reachable from within the cluster. NodePort exposes on nodes, Ingress is for external HTTP/S.",Kubernetes Fundamentals,Kubernetes Resources
4,What is the primary purpose of the Kubernetes API server in the control plane architecture?,To run containerized applications directly,To schedule Pods onto available worker nodes,To validate and process REST requests for API objects,To manage network traffic between Pods,To store cluster state in a time-series database,C,"The kube-apiserver is the frontend of the control plane, exposing the Kubernetes API. It processes and validates API requests, and updates the corresponding objects in etcd.",Kubernetes Fundamentals,Kubernetes API
5,"When a Pod is scheduled, what is the primary factor the kube-scheduler considers from the Pod's specification?",Container image version,restartPolicy,Resource requests and limits,serviceAccountName,labels,C,"The kube-scheduler filters nodes based on whether they can satisfy the Pod's resource requests (CPU, memory) and then ranks them based on various priority functions.",Kubernetes Fundamentals,Scheduling
6,Which component is NOT part of the Kubernetes control plane?,kube-apiserver,etcd,kube-scheduler,kube-proxy,kube-controller-manager,D,"kube-proxy runs on every node in the cluster and is responsible for maintaining network rules on nodes, enabling network communication to Pods from network sessions inside or outside of the cluster. It's a node component, not control plane.",Kubernetes Fundamentals,Kubernetes Architecture
7,"What core benefit does containerization (e.g., using Docker or containerd) provide for application deployment?",Automatic scaling of applications,Abstraction of the underlying operating system and kernel,Consistent runtime environment across different machines,Built-in service discovery and load balancing,Secure by default inter-container communication,C,"Containers bundle an application with its dependencies, ensuring it runs consistently regardless of the host environment, solving ""it works on my machine"" problems.",Kubernetes Fundamentals,Containers
8,"What is the main advantage of using a declarative approach (e.g., YAML manifests) to manage Kubernetes resources?",It allows for more complex scripting logic,It enables direct manipulation of etcd data,"It focuses on what desired state, not how to achieve it",It provides faster API response times,It simplifies single-container Pod deployments only,C,"Declarative configurations define the desired state, and Kubernetes controllers work to reconcile the current state to this desired state. This is more robust and idempotent than imperative commands.",Kubernetes Fundamentals,Kubernetes API
9,Why is container orchestration essential for managing microservices at scale?,It simplifies writing microservice code,It automatically converts monolithic apps to microservices,"It handles service discovery, scaling, and fault tolerance",It provides a centralized logging solution by default,It guarantees zero-downtime deployments,C,"Orchestrators like Kubernetes automate complex tasks like service discovery, load balancing, scaling based on demand, and self-healing, which are crucial for managing a distributed microservices architecture.",Cloud Native Infrastructure,Container Orchestration Fundamentals
10,"In Kubernetes, what is the primary role of Role-Based Access Control (RBAC)?",To define network traffic flow between Pods,To manage secure storage of sensitive data like passwords,To control user and service account access to API resources,To assign static IP addresses to Services,To encrypt container images at rest,C,"RBAC regulates access to Kubernetes API resources based on the roles of individual users or service accounts within the cluster, ensuring users only perform actions they are authorized for.",Cloud Native Infrastructure,Security
11,What is the function of a NetworkPolicy in Kubernetes?,To provide a stable DNS name for a set of Pods,To manage external access to services via HTTP/S routing,To define how Pods are allowed to communicate with each other,To assign IP addresses to newly created Pods,To encrypt traffic between services in a mesh,C,"NetworkPolicy resources specify how groups of Pods are allowed to communicate with each other and other network endpoints, acting as a firewall at the Pod level.",Cloud Native Infrastructure,Networking
12,What fundamental problem does a Service Mesh like Istio or Linkerd aim to solve in a microservices architecture?,Simplifying container image building,Automating infrastructure provisioning,Managing and observing inter-service communication,Providing persistent storage for stateful applications,Abstracting server management,C,"Service meshes provide a dedicated infrastructure layer for handling service-to-service communication, offering features 1  like traffic management, security (mTLS), and observability (metrics, traces) without requiring changes to application code.",Cloud Native Infrastructure,Service Mesh
13,A stateful application requires storage that persists even if its Pod is rescheduled to another Node. Which Kubernetes objects are essential for this?,ConfigMap and Secret,PersistentVolume (PV) and PersistentVolumeClaim (PVC),EphemeralVolume and HostPath volume,Service and EndpointSlice,Job and CronJob,B,"A PersistentVolume (PV) represents a piece of storage, and a PersistentVolumeClaim (PVC) is a request for that storage by a user/Pod. This decoupling allows storage to outlive Pods.",Cloud Native Infrastructure,Storage
14,Which security mechanism in Kubernetes is best suited for providing an identity to processes running in Pods to interact with the API server?,NetworkPolicy,SecurityContext,ServiceAccount,PodSecurityPolicy (deprecated) / PodSecurityAdmission,TLS Certificates for etcd,C,"ServiceAccounts provide an identity for processes that run in a Pod, which can then be granted permissions to API resources via RBAC Roles and RoleBindings.",Cloud Native Infrastructure,Security
15,What is the primary goal of Horizontal Pod Autoscaling (HPA) in Kubernetes?,To increase the resource limits of existing Pods,To adjust the number of Pod replicas based on metrics,To add or remove Nodes from the cluster,To automatically update container images,To manage storage capacity for stateful sets,B,"HPA automatically scales the number of Pod replicas in a workload resource (like a Deployment or StatefulSet) up or down based on observed CPU utilization, custom metrics, or external metrics.",Kubernetes Architecture,Autoscaling
16,"How does Serverless (e.g., FaaS like AWS Lambda or Knative Serving) primarily differ from traditional PaaS offerings?",Serverless does not use containers,Serverless applications cannot be stateful,Serverless abstracts away all underlying server management,PaaS does not offer auto-scaling capabilities,Serverless is only for event-driven functions,C,"Serverless computing (especially FaaS) aims to abstract away all infrastructure management, including servers, OS, and runtimes, allowing developers to focus solely on writing code that executes in response to events.",Kubernetes Architecture,Serverless
17,What is the primary role of the Cloud Native Computing Foundation (CNCF) in the Kubernetes ecosystem?,To directly employ Kubernetes core developers,To sell Kubernetes enterprise support subscriptions,To foster and sustain an ecosystem of open source projects,To define mandatory cloud provider APIs,To own the intellectual property of Linux,C,"The CNCF hosts and promotes a wide range of open source projects (including Kubernetes, Prometheus, Envoy) to advance cloud native computing, providing governance, support, and community building.",Kubernetes Architecture,Community and Governance
18,"In a typical cloud native environment, which persona is most concerned with ensuring application uptime, performance, and managing incident response?",Application Developer,Platform Consumer,Site Reliability Engineer (SRE) / Platform Operator,Business Analyst,End User,C,"SREs and Platform Operators are responsible for the reliability, scalability, and overall operational health of the platform and the applications running on it, including monitoring, alerting, and incident management.",Kubernetes Architecture,Roles and Personas
19,"Why are Open Standards, like those defined by the Open Container Initiative (OCI), critical for the cloud native ecosystem?",They guarantee better application performance,They enforce specific vendor implementations,They promote interoperability and prevent vendor lock-in,They reduce the need for security patching,They simplify the user interface of cloud platforms,C,"Open standards (e.g., OCI for container formats/runtimes, CNI for networking, CRI for runtimes) ensure that different tools and platforms can work together seamlessly, giving users choice and preventing vendor lock-in.",Kubernetes Architecture,Open Standards
20,Which type of telemetry data is most suitable for understanding the sequence of operations and latency across multiple microservices for a single user request?,Logs,Metrics,Traces (Distributed Tracing),Events,Alerts,C,"Distributed tracing captures the end-to-end flow of a request as it propagates through different services, providing insights into latency bottlenecks and dependencies.",Cloud Native Observability,Telemetry & Observability
21,Prometheus is primarily designed for which type of observability data?,Distributed tracing,Log aggregation and analysis,Time-series metrics collection and alerting,Security auditing and compliance reporting,Real-time user monitoring (RUM),C,"Prometheus excels at collecting, storing, and querying time-series data (metrics) from various targets, and it includes a powerful alerting mechanism based on PromQL.",Cloud Native Observability,Prometheus
22,"In Prometheus, what is an ""exporter""?",A component that sends alerts to notification channels,A database that stores long-term metric data,A client library for instrumenting application code,A piece of software that exposes metrics from third-party systems,A dashboard for visualizing metrics,D,"Exporters are helper services that fetch metrics from systems that don't natively expose them in Prometheus format (e.g., databases, hardware, message queues) and translate them into a format Prometheus can scrape.",Cloud Native Observability,Prometheus
23,What is a key challenge in cost management specifically related to shared Kubernetes clusters?,High cost of Kubernetes control plane components,Difficulty in attributing resource usage to specific teams/apps,Inability to use reserved instances with Kubernetes,Lack of tools for visualizing overall cloud spend,Fixed pricing models for all Kubernetes services,B,"In multi-tenant clusters, accurately tracking and attributing resource consumption (CPU, memory, storage, network) to different applications, teams, or cost centers can be complex due to the shared nature of resources.",Cloud Native Observability,Cost Management
24,Which principle is central to the GitOps methodology for application and infrastructure deployment?,Using imperative scripts stored in Git,Managing only stateless applications via Git,Treating Git as the single source of truth for desired state,Requiring manual approval for all Git commits,Using Git LFS for storing container images,C,"GitOps emphasizes a declarative approach where the entire desired state of the system (applications, infrastructure) is described in Git, and an automated process ensures the live environment converges to this state.",Cloud Native Application Delivery,GitOps
25,"In a CI/CD pipeline for a cloud native application, what is the typical output of the ""Continuous Integration"" (CI) phase?",A running application in production,A new Kubernetes cluster provisioned,A tested and versioned container image/artifact,A detailed cost analysis report,A set of user stories for the next sprint,C,"The CI phase focuses on building the application, running automated tests, and producing a reliable, versioned artifact (often a container image) that is ready for deployment.",Cloud Native Application Delivery,CI/CD
26,What is the primary benefit of implementing CI/CD pipelines for application delivery?,It eliminates the need for testing,It reduces infrastructure costs significantly,"It enables faster, more reliable software releases",It automatically writes application code,It replaces the need for version control systems,C,"CI/CD automates the build, test, and deployment processes, leading to increased release velocity, improved code quality through automated testing, and more consistent deployments.",Cloud Native Application Delivery,Application Delivery Fundamentals
27,What does a ReplicaSet ensure in Kubernetes?,That a Pod runs on every node,That a certain number of Pod replicas are running,That Pods have stable network identifiers,That external traffic can reach the Pods,That Pods are scheduled according to affinity rules,B,"A ReplicaSet's primary purpose is to maintain a stable set of replica Pods running at any given time, ensuring the desired number of instances of an application are available. Deployments manage ReplicaSets.",Kubernetes Fundamentals,Kubernetes Resources
28,Which of the following is NOT a core characteristic of cloud native architectures?,Microservices,Containers,Monolithic application design,DevOps practices,Automation,C,"Cloud native architectures typically favor microservices, containers, dynamic orchestration (like Kubernetes), and DevOps/Agile practices, moving away from large, tightly coupled monolithic designs.",Kubernetes Architecture,Cloud Native Principles (implied)
29,What is the main purpose of a ServiceAccount in Kubernetes when interacting with the API server?,To define network access policies for Pods,To provide an identity for Pods to authenticate to the API,To store sensitive credentials for applications,To group users for applying permissions,To manage DNS records for services,B,"ServiceAccounts provide an identity for processes running within Pods. This identity can be used to authenticate to the Kubernetes API server, and RBAC rules can grant it specific permissions.",Cloud Native Infrastructure,Security
30,"If you need to run a batch job that completes and then terminates, which Kubernetes workload resource is most suitable?",Deployment,StatefulSet,DaemonSet,Job,Service,D,"A Job creates one or more Pods and ensures that a specified number of them successfully terminate. It's ideal for batch tasks, while CronJob is for scheduled Jobs.",Kubernetes Fundamentals,Kubernetes Resources
31,"Which of the following best describes the concept of ""desired state"" in Kubernetes?",The current operational status of cluster nodes,The configuration specified by the user for their resources,The real-time metrics collected by Prometheus,The log output generated by running containers,The network policies applied to Pods,B,"Users define the desired state of their applications and infrastructure via Kubernetes API objects (e.g., in YAML files). Kubernetes controllers then continuously work to make the actual state of the cluster match this desired state.",Kubernetes Fundamentals,Kubernetes Architecture
32,Which OCI specification defines the format of a container image?,Runtime Specification,Image Specification,Distribution Specification,Network Specification,Storage Specification,B,"The OCI Image Specification defines how to create and package a container image, ensuring interoperability across different container tools and runtimes that adhere to the standard.",Kubernetes Fundamentals,Containers
33,What is a key difference between kubectl apply -f <filename> and kubectl create -f <filename>?,"apply is declarative, create is imperative","create can update existing resources, apply cannot","apply ignores existing resources, create fails if they exist","apply stores last-applied-configuration, create does not","create is idempotent, apply is not",D,"kubectl apply records the applied configuration in an annotation on the resource. This allows it to calculate a patch between the previous, current, and new desired state, making it suitable for declarative updates. create will fail if the resource exists.",Kubernetes Fundamentals,Kubernetes API
34,"In the context of container security, what does ""least privilege"" primarily refer to?",Running containers with minimal resource requests,Granting containers only the permissions they absolutely need,Using the smallest possible base container images,Limiting network access to containers,Encrypting all data within the container,B,"The principle of least privilege means that containers (and their processes) should run with only the capabilities and permissions essential for their function, reducing the potential impact of a compromise.",Cloud Native Infrastructure,Security
35,What is the primary function of kube-proxy when a Service of type ClusterIP is created?,It assigns an IP address from the cluster's Pod CIDR.,It modifies iptables or IPVS rules on nodes to route traffic.,It creates a DNS A record for the Service.,It terminates TLS connections for the Service.,It exposes the Service on a port on each Node.,B,"kube-proxy watches the API server for new Services and Endpoints. For ClusterIP Services, it configures network rules (e.g., iptables, IPVS) on each node to capture traffic destined for the Service's IP and load balance it to the backend Pods.",Cloud Native Infrastructure,Networking
36,What core benefit does a StatefulSet provide over a Deployment for applications like databases?,Automatic rolling updates by default,Simpler YAML configuration for Pod templates,"Stable, unique network identifiers and persistent storage",Support for hostNetwork: true,Higher number of allowed replicas,C,"StatefulSets are designed for stateful applications, providing stable, persistent identifiers (e.g., my-app-0, my-app-1) and per-instance persistent storage that follows the Pod identity.",Kubernetes Fundamentals,Kubernetes Resources
37,"What is the primary role of the ""Controller Manager"" in Kubernetes?",Manages user authentication and authorization,Exposes the Kubernetes API to external clients,Runs various controllers that regulate cluster state,Schedules Pods onto appropriate Nodes,Stores all cluster configuration data,C,"The kube-controller-manager runs multiple controller processes (e.g., Node controller, Replication controller, Endpoints controller) that watch for changes and work to drive the actual cluster state towards the desired state.",Kubernetes Fundamentals,Kubernetes Architecture
38,What is a primary characteristic of Vertical Pod Autoscaling (VPA)?,It adjusts the number of Pod replicas.,It adjusts the CPU and memory requests and limits for Pods.,It adds or removes Nodes from the cluster.,It automatically selects the optimal storage class.,It scales the number of available IP addresses.,B,"VPA recommends or automatically updates the resource requests and limits for containers within Pods to match actual usage, helping to optimize resource allocation. It does not change the number of replicas (that's HPA).",Kubernetes Architecture,Autoscaling
39,"Which statement accurately describes a key aspect of ""observability"" in cloud native systems?",It is solely focused on collecting system logs.,It primarily relies on manual health checks by operators.,It enables understanding a system's internal state from its outputs.,It is achieved by using proprietary monitoring tools.,It is only relevant for production environments.,C,"Observability is the ability to infer the internal state and behavior of a complex system by examining its outputs (logs, metrics, traces). This allows for better troubleshooting, understanding performance, and proactive issue detection.",Cloud Native Observability,Telemetry & Observability
40,"In Prometheus, what does the up metric typically indicate for a scraped target?",The version number of the target application.,The number of active user connections to the target.,Whether Prometheus was able to successfully scrape the target.,The CPU utilization of the target.,The total uptime of the target since it started.,C,"The up{job=""<job_name>"", instance=""<instance_id>""} metric is automatically generated by Prometheus. A value of 1 means the scrape was successful; 0 means it failed. This is fundamental for monitoring target health.",Cloud Native Observability,Prometheus
41,"From a FinOps perspective in a Kubernetes environment, why is tagging resources (e.g., with labels) important?",It improves the scheduling efficiency of Pods.,It enables more accurate cost allocation and showback/chargeback.,It automatically secures inter-Pod communication.,It increases the performance of PersistentVolumes.,It simplifies the process of upgrading Kubernetes.,B,"Labels and annotations applied to Kubernetes resources (Namespaces, Deployments, Pods, etc.) can be used by cost management tools to categorize and attribute costs to different teams, projects, or applications, supporting FinOps practices.",Cloud Native Observability,Cost Management
42,What is a key advantage of using GitOps for managing Kubernetes deployments compared to traditional CI/CD push-based deployments?,GitOps pipelines are significantly faster to execute.,GitOps eliminates the need for container registries.,GitOps enhances security by reducing direct cluster access for CI.,GitOps does not require YAML manifests for resources.,GitOps is only suitable for small-scale deployments.,C,"In GitOps, the CI system typically pushes an image to a registry and updates a Git repo. An agent inside the cluster pulls changes from Git, reducing the CI system's need for direct cluster credentials and providing a stronger security posture.",Cloud Native Application Delivery,GitOps
43,"Which of these is a core component of a ""Continuous Delivery"" pipeline but NOT necessarily ""Continuous Deployment""?",Automated building of code into an artifact.,Automated execution of unit and integration tests.,Automated deployment to a staging/QA environment.,Automated deployment to the production environment.,Manual approval gate before production deployment.,E,"Continuous Delivery ensures every validated change is releasable to production, often with a manual approval step. Continuous Deployment automates the release to production without manual intervention if all prior stages pass. Both include A, B, C.",Cloud Native Application Delivery,CI/CD
44,"What Kubernetes feature allows you to define constraints on which Nodes your Pods can run, based on Node labels?",NetworkPolicy,ResourceQuota,nodeSelector / nodeAffinity,PodDisruptionBudget,LimitRange,C,"nodeSelector provides a simple way to constrain Pods to Nodes with specific labels. nodeAffinity offers more expressive rules, including ""preferred"" and ""required"" constraints.",Kubernetes Fundamentals,Scheduling
45,"Which of these is a primary goal of the CNCF's ""Trail Map"" for cloud native adoption?",To mandate specific vendor products for each stage.,To provide a prescriptive path for building cloud native apps.,To offer a recommended journey and project choices for adopters.,To rank cloud providers based on their Kubernetes offerings.,To certify individual developers as cloud native experts.,C,"The CNCF Trail Map suggests a path for organizations adopting cloud native technologies, highlighting CNCF projects that can help at different stages (e.g., containerization, CI/CD, orchestration, observability).",Kubernetes Architecture,Community and Governance
46,"What is the primary motivation behind using ""Serverless Functions"" (FaaS)?",To achieve higher compute density on physical servers.,"To run long-lived, stateful batch processing jobs.",To execute event-driven code without managing infrastructure.,To gain fine-grained control over OS-level configurations.,"To build complex, monolithic application backends.",C,"Serverless functions are designed for short-lived, event-driven computations where the underlying infrastructure (servers, OS) is completely managed by the platform, allowing developers to focus on code.",Kubernetes Architecture,Serverless
